Announce Date,Acquirer Ticker,Target Ticker,Deal Description
2014-12-01,CY US,CODE US,"On 12/01/2014, it was announced that Spansion Inc and Cypress Semiconductor Corp would merge in an all-stock transaction. The combined company is expected to achieve cost synergies of USD 135.00M within the first year after the transaction closes. Transaction was completed on 03/13/2015."
1998-05-18,NFS US,2935Q US,Nationwide Financial Services Inc acquired Allied Group Inc for USD 1628.49M. The transaction was announced on 5/18/1998 and completed on 11/13/1998.
2013-06-24,THC US,VHS US,"Tenet Healthcare Corp acquired Vanguard Health Systems Inc for USD 4,095.92M. The transaction was announced on 06/24/2013 and completed on 10/01/2013. The purpose of this transaction includes geographic expansion as well as increased market share."
2017-09-19,POST US,BOBE US,"Post Holdings Inc announced the acquisition of Bob Evans Farms Inc for USD 1,612.90M. The transaction was announced on 09/19/2017 and was completed on 01/16/2018. At the time of announcement, this is the third largest acquisition on record for Post Holdings Inc."
2010-06-11,BPL US,0618586D US,A consortium led by Lehman Brothers Holdings Inc sold Buckeye GP Holdings LP to Buckeye Partners LP for USD 1610.57M. The transaction was announced on 6/11/2010 and completed on 11/22/2010.
2000-02-14,GLW US,783511Q US,Corning Inc acquired Corning NetOptix Inc for USD 1604.31M. The transaction was announced on 2/14/2000 and completed on 5/15/2000.
2005-06-15,IDTI US,ICST US,Integrated Device Technology Inc acquired Integrated Circuit Systems Inc for USD 1604.15M. The transaction was announced on 6/15/2005 and completed on 9/19/2005.
2021-03-04,AMGN US,FPRX US,Amgen Inc acquired Five Prime Therapeutics Inc for USD 1603.11M. The transaction was announced on 3/4/2021 and completed on 4/19/2021.
1999-10-27,HLIT US,3011Q US,Harmonic Inc acquired C-Cube Microsystems Inc/Old for USD 1601.43M. The transaction was announced on 10/27/1999 and completed on 5/3/2000.
2006-08-21,4622869Z US,GLB US,Morgan Stanley Real Estate acquired Glenborough Realty Trust Inc for USD 1601.19M. The transaction was announced on 8/21/2006 and completed on 11/30/2006.
2021-03-26,SPHR US,MSGN US,Sphere Entertainment Co acquired MSG Networks Inc for USD 1598.76M. The transaction was announced on 3/26/2021 and completed on 7/9/2021.
2015-02-12,EXPE US,OWW US,"On 02/12/2015, Expedia Inc announced it agreed to acquire Orbitz Worldwide Inc for USD 1,595.50M. This will give Expedia access to a greater customer database and this is its second biggest acquisition as of announcement date. The transaction was completed on 09/17/2015. Orbitz was reported t..."
2009-05-12,ANRZQ US,8230905Q US,Alpha Natural Resources Inc acquired Alpha Natural Resource Inc/Old for USD 1593.87M. The transaction was announced on 5/12/2009 and completed on 8/3/2009.
2000-04-06,MTOR US,792061Q US,Meritor Inc acquired Meritor Automotive Inc for USD 1586.99M. The transaction was announced on 4/6/2000 and completed on 7/10/2000.
1999-02-01,ETN US,968734Q US,Eaton Corp PLC acquired Aeroquip-Vickers Inc for USD 1585.83M. The transaction was announced on 2/1/1999 and completed on 4/12/1999.
1998-04-02,0574018D US,716143Q US,Archstone-Smith Trust acquired Security Capital Atlantic Inc for USD 1585.76M. The transaction was announced on 4/2/1998 and completed on 7/7/1998.
1999-08-18,1837572D US,XLSW US,Nokia of America Corp acquired Excel Switching Corp for USD 1585.66M. The transaction was announced on 8/18/1999 and completed on 11/4/1999.
2000-10-10,MFNXQ US,923098Z US,Metromedia Fiber Network Inc acquired Sitesmith Inc for USD 1583.38M. The transaction was announced on 10/10/2000 and completed on 2/8/2001.
2002-12-06,IBM US,RATL US,International Business Machine acquired Rational Software Corp for USD 1576.38M. The transaction was announced on 12/6/2002 and completed on 2/21/2003.
1999-04-13,CSCO US,GEOC US,Cisco Systems Inc acquired Geotel Communications Corp for USD 1575.48M. The transaction was announced on 4/13/1999 and completed on 6/25/1999.
1999-10-14,INTC US,70663Q US,Intel Corp acquired DSP Communications Inc for USD 1574.42M. The transaction was announced on 10/14/1999 and completed on 11/22/1999.
2008-06-19,BX US,1950710D US,Blackstone Inc acquired Apria Healthcare Group Inc for USD 1571.18M. The transaction was announced on 6/19/2008 and completed on 10/29/2008.
1999-09-20,166783Q US,3677556Q US,T-Mobile USA Inc acquired Aerial Communications Inc for USD 1570.97M. The transaction was announced on 9/20/1999 and completed on 5/5/2000.
2008-07-21,BRCD US,FDRY US,Brocade Communications Systems LLC acquired Foundry Networks LLC for USD 1567.98M. The transaction was announced on 7/21/2008 and completed on 12/19/2008.
2010-04-04,SD US,1464150D US,SandRidge Energy Inc acquired Arena Resources Inc for USD 1563.56M. The transaction was announced on 4/4/2010 and completed on 7/19/2010.
2017-01-30,KEYS US,XXIA US,"On 01/30/2017 Keysight Technologies announced the acquisition of Ixia. At the time of announcement, this is Keysight's largest acquisition on record. It was reported on 01/23/2016 that Ixia was in talks to put itself up for sale, people familiar with the matter said. Ixia was attracting takeo..."
2022-01-10,ACH US,APR US,Accendra Health Inc acquired Apria Inc for USD 1557.82M. The transaction was announced on 1/10/2022 and completed on 3/30/2022.
2009-09-15,ADBE US,OMTR US,Adobe Inc acquired Omniture LLC for USD 1554.44M. The transaction was announced on 9/15/2009 and completed on 10/26/2009.
2007-09-17,9876552D US,EDO US,ITT Corp acquired EDO Corp for USD 1551.11M. The transaction was announced on 9/17/2007 and completed on 12/21/2007.
1998-12-14,GMH US,USSB US,Hughes Electronics Corp/Old acquired US Satellite Broadcasting Co for USD 1550.72M. The transaction was announced on 12/14/1998 and completed on 5/20/1999.
2004-08-16,LPNT US,PRV US,Legacy LifePoint Health LLC acquired Province Healthcare Co for USD 1550.02M. The transaction was announced on 8/16/2004 and completed on 4/18/2005.
2005-05-31,3867693Z US,BKD US,Fortress Investment Group LLC acquired Brookdale Senior Living Inc for USD 1550.00M. The transaction was completed on 5/31/2005.
2002-02-04,BBWI US,387086Q US,Bath & Body Works Inc acquired Intimate Brands Inc for USD 1549.54M. The transaction was announced on 2/4/2002 and completed on 3/22/2002.
2017-10-23,CSCO US,BSFT US,"On 10/23/2017, Cisco announced that it would acquire BroadSoft for USD 55.00 per share in cash valuing the transaction at USD 1,545.912M. On 10/22/2017, it was reported that Cisco Systems Inc was close to a deal to acquire BroadSoft Inc which has a market value of about USD 1,700.00M, accordi..."
2006-03-13,AGN US,ADRX US,Allergan Ltd/Ireland acquired Andrx Corp for USD 1545.26M. The transaction was announced on 3/13/2006 and completed on 11/6/2006.
1999-09-23,ELNK US,2897Q US,EarthLink Holdings Corp acquired Earthlink Network Inc for USD 1543.27M. The transaction was announced on 9/23/1999 and completed on 2/7/2000.
2001-11-06,2309719Q US,SUS US,Security Capital Group Inc acquired Storage USA Inc for USD 1542.76M. The transaction was announced on 11/6/2001 and completed on 4/29/2002.
2007-07-23,HPQ US,OPSW US,HP Inc acquired Opsware Inc for USD 1540.35M. The transaction was announced on 7/23/2007 and completed on 9/21/2007.
2021-02-25,MRK US,PAND US,Merck & Co Inc acquired Pandion Therapeutics Inc for USD 1538.87M. The transaction was announced on 2/25/2021 and completed on 4/5/2021.
2018-08-15,CCMP US,KMG US,"On 11/15/2018, the transaction is completed. On 08/15/2018, it was announced that Cabot Microelectronics Corp and KMG Chemicals Inc had entered into a definitive agreement under which Cabot Microelectronics would acquire KMG in a cash and stock transaction. KMG shareholders would receive USD ..."
2015-08-04,2556796D US,IPCM US,"On 08/04/2015, it was announced that Team Health Holdings Inc will acquire IPC Healthcare Inc for USD 80.25 per share, giving the deal a value of USD 1,532.06M. The deal will create a leading physician services organization spanning multiple specialties according to TeamHealth's president and..."
2018-11-19,XEC US,REN US,"On 11/19/2018, it was announced that Cimarex Energy Co signed a definitive agreement to acquire all of the outstanding stock of Resolute Energy Corp, in a cash or stock transaction, with the announced transaction value of USD 1,531.82M. The transaction was completed on 03/01/2019. At the mome..."
1999-06-09,SVU US,RFH US,SUPERVALU Inc acquired Richfood Holdings Inc for USD 1527.72M. The transaction was announced on 6/9/1999 and completed on 9/1/1999.
1999-02-11,M US,FHT US,Macy's Inc acquired Fingerhut Cos Inc for USD 1527.53M. The transaction was announced on 2/11/1999 and completed on 3/23/1999.
2010-09-21,PVR US,0117799D US,PVR Partners LP acquired Penn Virginia GP Holdings LP for USD 1525.05M. The transaction was announced on 9/21/2010 and completed on 3/11/2011.
2010-08-19,FNFG US,NAL US,First Niagara Financial Group Inc acquired NewAlliance Bancshares Inc for USD 1522.73M. The transaction was announced on 8/19/2010 and completed on 4/18/2011.
1998-04-03,AF US,0663487D US,Astoria Financial Corp acquired Long Island Bancorp Inc for USD 1521.32M. The transaction was announced on 4/3/1998 and completed on 10/1/1998.
2003-06-09,GD US,329552Q US,General Dynamics Corp acquired Veridian Corp/United States for USD 1521.22M. The transaction was announced on 6/9/2003 and completed on 8/12/2003.
2015-10-28,1859004D US,0221668D US,Starwood Hotels & Resorts Worldwide LLC sold Vistana Signature Experiences Inc to ILG LLC for USD 1517.61M. The transaction was announced on 10/28/2015 and completed on 5/13/2016.
2007-05-14,CAH US,VAS US,Cardinal Health Inc acquired CareFusion 202 Inc for USD 1517.20M. The transaction was announced on 5/14/2007 and completed on 6/29/2007.
2005-01-30,LEE US,PTZ US,Lee Enterprises Inc acquired Pulitzer Inc for USD 1517.00M. The transaction was announced on 1/30/2005 and completed on 6/6/2005.
1999-05-10,1825471D US,1053309Q US,Georgia-Pacific LLC acquired Veritiv Operating Co for USD 1514.96M. The transaction was announced on 5/10/1999 and completed on 7/7/1999.
2013-02-20,9995522D US,OMX US,Office Depot Inc acquired OfficeMax Inc for USD 1512.45M. The transaction was announced on 02/20/2013 and completed on 11/06/2013. This has been the largest deal in the Retail Office Supplies industry in the past three years as of announcement date.
2001-11-19,MHK US,DTL US,Mohawk Industries Inc acquired Dal-Tile International Inc for USD 1509.89M. The transaction was announced on 11/19/2001 and completed on 3/21/2002.
2007-04-05,1986522D US,BSTE US,Alere Inc acquired Biosite Inc for USD 1509.13M. The transaction was announced on 4/5/2007 and completed on 7/2/2007.
1998-12-16,QTRN US,ENVY US,Quintiles Transnational Corp acquired Envoy Corp for USD 1507.59M. The transaction was announced on 12/16/1998 and completed on 3/31/1999.
1998-03-18,ITG US,3036Q US,Investment Technology Group Inc acquired Investment Technology Group Inc/Old for USD 1507.27M. The transaction was announced on 3/18/1998 and completed on 4/28/1999.
2018-06-29,L US,BWP US,"Loews Corp announced the acquisition of remainder of Boardwalk Pipeline Partners LP, through its GP, Boardwalk GP LP. At the time of the announcement, Loews Corp owned 50.17% of Boardwalk Pipeline Partners LP. The deal is for USD 12.06 per target share, representing total transaction value of..."
2017-12-18,HSY US,BETR US,"On 12/18/2017, it is reported that The Hershey Co is said to near USD 1,600.00M deal to buy Amplify Snack Brands Inc."
2019-11-01,GOOGL US,FIT US,Alphabet Inc acquired Fitbit Inc for USD 1501.85M. The transaction was announced on 11/1/2019 and completed on 1/14/2021.
2018-09-06,SSNC US,IL US,"On 09/05/2018, Reuters reported that SS&C Technologies could reach an agreement with Intralinks’s private equity owner Siris Capital Group as early as this week, citing unidentified people familiar with the matter."
2018-08-08,WSFS US,BNCL US,"WSFS Financial Corp acquired Beneficial Bancorp Inc for USD 1,493.80M. The transaction was announced on 08/08/2018 and completed on 03/01/2019. At the moment of completion, this is the biggest acquisition for WSFS Financial Corp on record."
1999-06-23,MFNXQ US,ABOV US,Metromedia Fiber Network Inc acquired AboveNet Communications Inc for USD 1489.60M. The transaction was announced on 6/23/1999 and completed on 9/9/1999.
2020-07-22,,GEENQ US,"A consortium led by Apollo Global Management, Inct announced the acquisition of Global Eagle Entertainment Inc for USD 675.00M. The transaction was announced on 07/22/2020 and is currently pending."
2007-08-28,MHS US,PLMD US,Medco Health Solutions Inc acquired PolyMedica Corp for USD 1488.63M. The transaction was announced on 8/28/2007 and completed on 11/1/2007.
2013-11-26,TLRDQ US,JOSB US,"The Men's Wearhouse Inc proposed to acquire Jos A Bank Clothiers Inc for USD 55 per share on 11/26/2013, which was rejected by Jos A Bank Board of Directors. This came less than two weeks after Men's Wearhouse Inc let a takeover bid from Jos A Bank Clothiers Inc expire without entering discus..."
2010-09-13,HPQ US,1576198D US,HP Inc acquired ArcSight LLC for USD 1484.57M. The transaction was announced on 9/13/2010 and completed on 10/25/2010.
2014-02-24,RFMD US,TQNT US,"RF Micro Devices Inc announced the acquisition of TriQuint Semiconductor Inc for USD 1,428.33M. This acquisition is to create the necessary scale for exploiting global growth opportunities in the mobile devices, network infrastructure, and aerospace segments. The transaction was announced on ..."
2012-08-21,THRY US,1545935D US,"Dex Media Inc acquired SuperMedia Inc for USD 1473.52M. The transaction was announced on 08/21/2012 and was completed on 05/01/2013. The business that formed as a result of the transaction will benefit from improved operating scale, significant synergies and enhanced cash flow. On a pro-forma..."
2018-05-10,LLY US,ARMO US,"Eli Lilly & Co announced the acquisition of ARMO BioSciences Inc for USD 1,470.78M. The transaction was announced on 05/10/2018 and was completed on 06/25/2018. At the time of announcement this is Eli Lilly's 5th largest acquisition on record."
2000-04-17,SANM US,HDC US,Sanmina Corp acquired Hadco Corp for USD 1469.14M. The transaction was announced on 4/17/2000 and completed on 6/26/2000.
2015-03-09,AA US,RTI US,"Merger has been completed as of 07/23/2015. On 03/09/2015, Alcoa Inc announced the acquisition of RTI International Metals Inc for USD 1,468.34M. At the time of this announcement, this is the second largest acquisition by Alcoa Inc since 2010."
2005-02-27,YELLQ US,3542013Q US,Yellow Corp acquired USF Corp for USD 1467.41M. The transaction was announced on 2/27/2005 and completed on 5/25/2005.
2011-10-24,ORCL US,RNOW US,"Oracle Corp acquired RightNow Technologies Inc for USD 1467.37M. The transaction was announced on 10/24/2011 and completed on 01/27/2012. RightNow's leading cloud-based Customer Service offering helps organizations deliver exceptional customer experiences across the web, social networks and c..."
2006-09-15,9876456D US,TWPL US,Southern Union Co sold Transwestern Pipeline Co LLC to ETP Legacy LP for USD 1465.00M. The transaction was announced on 9/15/2006 and completed on 11/1/2006.
2003-10-06,UCOMA US,UGCE US,UnitedGlobalCom LLC acquired Liberty Global Europe LLC for USD 1461.32M. The transaction was announced on 10/6/2003 and completed on 12/22/2003.
2021-08-11,EXE US,VEI US,Expand Energy Corp acquired Vine Energy Inc for USD 1459.77M. The transaction was announced on 8/11/2021 and completed on 11/2/2021.
2003-11-25,ICBC US,SIB US,Independence Community Bank Corp acquired Staten Island Bancorp Inc for USD 1453.03M. The transaction was announced on 11/25/2003 and completed on 4/13/2004.
2009-06-18,WBMD US,1260972D US,WebMD Health Corp acquired HLTH Corp for USD 1451.57M. The transaction was announced on 6/18/2009 and completed on 10/24/2009.
2013-01-31,LNWO US,0966576D US,"Scientific Games Corp acquired WMS Industries Inc for USD 1449.26M in cash. The transaction was announced on 01/31/2013, completed on 10/18/2013, and the deal was the second largest in its industry at the time of completion. As a result of the transaction, Scientific Games expects to achieve ..."
2021-05-10,TRUL CN,HARV CN,Trulieve Cannabis Corp acquired Harvest Health & Recreation Inc for CAD 1751.66M. The transaction was announced on 5/10/2021 and completed on 10/5/2021.
2000-08-21,WAMUQ US,1707737D US,Washington Mutual Inc acquired Bank United Corp for USD 1446.51M. The transaction was announced on 8/21/2000 and completed on 2/12/2001.
2003-10-14,2258717D US,DCTM US,EMC Corp acquired Documentum Inc for USD 1445.35M. The transaction was announced on 10/14/2003 and completed on 12/19/2003.
2004-07-01,CRL US,IRGI US,Charles River Laboratories International Inc acquired Inveresk Research Group Inc for USD 1444.99M. The transaction was announced on 7/1/2004 and completed on 10/21/2004.
1998-01-20,,2880Q US,A consortium led by HM Capital Partners LLC acquired Regal Cinemas Inc/Old for USD 1444.00M. The transaction was announced on 1/20/1998 and completed on 5/28/1998.
2007-05-04,WFC US,GBBK US,Wells Fargo & Co acquired Greater Bay Bancorp for USD 1438.97M. The transaction was announced on 5/4/2007 and completed on 10/1/2007.
1999-03-03,JNY US,866200Q US,Jones Group Inc/NY acquired Nine West Group Inc for USD 1438.50M. The transaction was announced on 3/3/1999 and completed on 6/16/1999.
2006-08-15,1856613D US,DLP US,Monsanto Co acquired Delta & Pine Land Co for USD 1436.97M. The transaction was announced on 8/15/2006 and completed on 6/4/2007.
1999-06-28,WEC US,WIC US,WEC Energy Group Inc acquired Wicor Inc for USD 1434.06M. The transaction was announced on 6/28/1999 and completed on 4/27/2000.
2007-02-16,,2304786Q US,"A consortium led by Simon Property Group Inc acquired The Mills Corp for USD 5715.69M. The transaction was announced on 02/05/2007 and completed on 04/03/2007. This deal was the largest acquistion by SPG as a public company, dating back to 06/25/2002."
2016-12-05,CNSL US,FRP US,"On 12/05/2016, Consolidated Communications Holdings Inc announced the acquisition of FairPoint  Communications Inc for USD 0.73 per share in stock for a total value of USD 1,418.38M. The deal was completed on 07/05/2017. At the time of the announcement, this is  Consolidated Communications' l..."
2018-02-13,KMPR US,IPCC US,Kemper Corp acquired Infinity Property and Casualty Corp for USD 1417.19M. The transaction was announced on 2/13/2018 and completed on 7/3/2018.
1998-05-26,HTV US,2458Q US,Hearst Television Inc acquired Pulitzer Publishing Co for USD 1415.71M. The transaction was announced on 5/26/1998 and completed on 3/19/1999.
2006-05-12,BKD US,1864773D US,Brookdale Senior Living Inc acquired American Retirement Corp for USD 1411.75M. The transaction was announced on 5/12/2006 and completed on 7/26/2006.
1998-12-18,3692470Q US,ALNT US,Alltel Corp acquired Aliant Communications Inc for USD 1410.71M. The transaction was announced on 12/18/1998 and completed on 7/2/1999.
2015-06-15,EXR US,STTP US,"On 06/15/2015 it was announced that SmartStop Self Storage Inc entered into a definitive agreement to be acquired by Extra Space Storage Inc for USD 13.75 per share, where a total purchase price is of USD 1,290.00M in cash and the remaining of USD 120.00M from sale of certain assets by SmartS..."
2005-01-24,1856613D US,SMNS US,Fox Paine & Co LLC sold Seminis Inc to Monsanto Co for USD 1400.00M. The transaction was announced on 1/24/2005 and completed on 3/23/2005.
2013-12-26,TXT US,BCHHU US,Textron Inc announced the acquisition of Beech Holdings LLC for USD 1400.00M. The transaction was announced on 12/26/2013 and completed on 03/14/2014. This deal significantly expands the general aviation business of Textron.
2013-06-09,1919709D US,POLL US,"IHS Inc acquired RL Polk & Co for USD 1400.00M. The transaction was announced on 06/09/2013 and completed on 06/17/2013. Not only is this the alrgest deal in IHS history, but it is also the second largest deal in the Diversified Operations industry in the past three years as of announcement d..."
2004-10-25,CLP US,TCR US,Colonial Properties Trust acquired Cornerstone Realty Income Trust Inc for USD 1398.11M. The transaction was announced on 10/25/2004 and completed on 4/4/2005.
2012-06-01,VZ US,HUTC US,"Verizon Communications Inc acquired HUGHES Telematics Inc for USD 1387.60M. The transaction was announced on 06/01/2012, completed on 07/26/2012, and was the second largest deal in its industry at the time of completion. The purpose of this transaction was to expand Verizon’s capabilities i..."
2009-07-27,A US,VARI US,Agilent Technologies Inc acquired Varian Inc for USD 1387.18M. The transaction was announced on 7/27/2009 and completed on 5/17/2010.
2017-08-02,,PMC US,"A consortium led by Walgreens Boots Alliance Inc announced the acquisition of PharMerica Corp for USD 1,383.82M. The transaction was announced on 08/02/2017 and was completed on 12/08/2017. At the time of announcement, this is KKR's fifth largest acquisition year to date."
2021-05-10,CIVI US,XOG US,Civitas Resources Inc acquired Extraction Oil & Gas Inc for USD 1382.69M. The transaction was announced on 5/10/2021 and completed on 11/2/2021.
2013-05-29,SCI US,STEI US,Service Corp International/US acquired Stewart Enterprises Inc for USD 1378.87M. The transaction was announced on 05/29/2013 and completed on 12/24/2013. The acquisition will expand SCI's unparalleled network in the highly fragemnted funeral and cemetery industry in North America.
2010-12-22,HWC US,WTNY US,Hancock Whitney Corp acquired Whitney Holding Corp/LA for USD 1377.74M. The transaction was announced on 12/22/2010 and completed on 6/7/2011.
2016-07-21,FNB US,YDKN US,"On 07/21/2016, FNB Corp announced it would acquire Yadkin Financial Corp in an all stock merger. On 05/25/2016, it was reported that Yadkin Financial Corp is working with Sandler O’Neill & Partners LP to solicit offers, according to people with knowledge of the matter."
2002-07-08,EBAY US,1293318D US,eBay Inc acquired PayPal Inc for USD 1370.86M. The transaction was announced on 7/8/2002 and completed on 10/4/2002.
2003-06-02,3029830Q US,JDEC US,Peoplesoft Inc acquired JD Edwards & Co/CO for USD 1370.56M. The transaction was announced on 6/2/2003 and completed on 8/29/2003.
2003-07-14,ATBA AV,OVER US,Altaba Inc acquired Overture Services Inc for USD 1370.26M. The transaction was announced on 7/14/2003 and completed on 10/8/2003.
1999-01-11,611214Q US,DOSE US,Bergen Brunswig Corp acquired PharMerica Long-Term Care Inc for USD 1366.50M. The transaction was announced on 1/11/1999 and completed on 4/27/1999.
2016-12-13,PTEN US,SVNT US,"On 12/13/2016, Patterson-UTI Energy will buy Seventy Seven Energy's for 49.6M shares valuing Seventy Seven Energy at USD 1,617.4284M including USD 336.00M of debt net of cash and warrant proceed. This is the biggest deal Patterson-UTI Energy Inc was involved within past 10 years at the time o..."
2015-12-03,AMH US,ARPI US,"American Homes 4 Rent acquired American Residential Properties Inc for USD 1,363.46M. The merger was announced on 12/03/2015 and completed on 03/01/2016. American Residential Properties received 1.135 shares of every 1 share owned. The combined company will be the  largest publicly-traded own..."
2007-08-16,DRI US,0895734D US,Darden Restaurants Inc acquired Rare Hospitality International Inc for USD 1361.01M. The transaction was announced on 8/16/2007 and completed on 10/2/2007.
2000-08-15,CAR US,2882689Q US,Avis Budget Group Inc acquired Avis Group Holdings LLC for USD 1360.96M. The transaction was announced on 8/15/2000 and completed on 3/1/2001.
2017-10-23,PCH US,DEL US,"On 10/23/2017, Potlatch Corp entered a definitive agreement to acquire Deltic Timer Corp for a stock consideration of 1.80 acquirer shares per target share. The transaction was completed on 02/21/2018. On 10/22/2017, Wall Street Journal reported that Potlatch Corp was said to be near a deal t..."
1998-11-17,8394653Q US,MDN US,Prologis acquired Meridian Industrial Trust for USD 1360.52M. The transaction was announced on 11/17/1998 and completed on 3/31/1999.
2007-05-02,C US,BSG US,Citigroup Inc acquired BISYS Group Inc/The for USD 1358.02M. The transaction was announced on 5/2/2007 and completed on 8/2/2007.
2000-03-31,HIG US,1296456D US,Hartford Insurance Group Inc/T acquired Talcott Resolution Life Inc for USD 1357.37M. The transaction was announced on 3/31/2000 and completed on 6/28/2000.
1999-11-14,GLW US,8766207Q US,Corning Inc acquired Corning Oak Holdings LLC for USD 1356.42M. The transaction was announced on 11/14/1999 and completed on 1/31/2000.
2018-06-28,SNX US,CVG US,"On 10/03/2018, it was announced that the final price to be paid will be USD 13.25 per share and 0.1263 SYNNEX common shares for each of Convergys common stock. On 06/28/2018, it was announced that Synnex Corp and Convergys have signed a definitive merger agreement to acquire Convergys for USD..."
2013-09-25,SYK US,MAKO US,"Stryker Corp acquired MAKO Surgical Corp for USD 1351.19M. The transaction was announced on 09/25/2013 and completed on 12/18/2013. Under the terms of the agreement, MAKO stockholders will recieve $30.00 per share in cash at the closing of the merger."
2001-12-03,2207158D US,1395930D US,"Medimmune LLC acquired MedImmune Vaccines Inc for USD 1,314.19M. The transaction was announced on 12/03/2001 and completed on 01/16/2002."
2020-05-05,ALXN US,PTLA US,Alexion Pharmaceuticals Inc/MA acquired Portola Pharmaceuticals Inc for USD 1345.17M. The transaction was announced on 5/5/2020 and completed on 7/6/2020.
