Announce Date,Acquirer Ticker,Target Ticker,Deal Description
2006-02-08,BORL US,SEGU US,Borland Software Corp acquired Segue Software Inc for USD 83.84M. The transaction was announced on 2/8/2006 and completed on 4/20/2006.
2000-02-14,1670211D US,81980Q US,Dura Pharmaceuticals Inc acquired Spiros Development Corp II Inc./Dura Pharmaceuticals Inc for USD 83.81M. The transaction was announced on 2/14/2000 and completed on 9/1/2000.
2018-06-12,NWBI US,5078885Z US,Union National Financial Corp/The sold Donegal Financial Services Corp to Northwest Bancshares Inc for USD 83.77M. The transaction was announced on 6/12/2018 and completed on 3/8/2019.
2004-04-29,1978022D US,ONES US,infoGroup Inc acquired Avention Inc for USD 83.65M. The transaction was announced on 4/29/2004 and completed on 6/10/2004.
2017-07-27,HFWA US,PUGB US,Heritage Financial Corp/WA acquired Puget Sound Bancorp Inc for USD 83.57M. The transaction was announced on 7/27/2017 and completed on 1/16/2018.
1998-01-21,RCNCQ US,EROL US,RCN Corp/Old acquired Erols Internet Inc for USD 83.50M. The transaction was announced on 1/21/1998 and completed on 2/25/1998.
2015-10-26,GABC US,,German American Bancorp Inc acquired River Valley Bancorp/IN for USD 83.46M. The transaction was announced on 10/26/2015 and completed on 3/1/2016.
2020-07-28,ENVA US,ONDK US,Enova International Inc acquired On Deck Capital Inc for USD 83.25M. The transaction was announced on 7/28/2020 and completed on 10/13/2020.
2012-01-26,TMP US,1368189D US,Tompkins Financial Corp acquired VIST Financial Corp for USD 83.12M. The transaction was announced on 1/26/2012 and completed on 8/2/2012.
2000-01-31,696119Q US,1435941D US,Thermo Instrument Systems Inc acquired Thermoquest Corp for USD 83.11M. The transaction was announced on 1/31/2000 and completed on 5/12/2000.
1998-08-20,DIAN US,717787Q US,DIANON Systems Inc acquired Urocor Inc for USD 83.03M. The transaction was announced on 8/20/1998 and completed on 11/12/1998.
2015-08-31,CG US,BTH US,Carlyle Group Inc/The acquired Partylite Inc for USD 82.96M. The transaction was announced on 8/31/2015 and completed on 10/15/2015.
2008-02-15,FNB US,IRGB US,FNB Corp/PA acquired Iron & Glass Bancorp Inc for USD 82.93M. The transaction was announced on 2/15/2008 and completed on 8/19/2008.
2010-01-08,TCF US,OKFC US,TCF Financial Corp acquired OAK Financial Corp for USD 82.92M. The transaction was announced on 1/8/2010 and completed on 5/3/2010.
1999-09-20,1996074D US,BPCO US,El Paso LLC acquired Bonneville Pacific Corp for USD 82.67M. The transaction was announced on 9/20/1999 and completed on 1/19/2000.
2001-12-13,WFC US,TEJA US,Wells Fargo & Co acquired Tejas Bancshares Inc for USD 82.50M. The transaction was completed on 12/13/2001.
1999-08-02,TMP US,LEBC US,Tompkins Financial Corp acquired Letchworth Independent Bancshares Corp for USD 82.43M. The transaction was announced on 8/2/1999 and completed on 1/3/2000.
2004-08-12,ESBF US,PHSB US,ESB Financial Corp acquired PHSB Financial Corp for USD 82.24M. The transaction was announced on 8/12/2004 and completed on 2/14/2005.
1998-01-18,CLGX US,NAIG US,CoreLogic Inc acquired National Information Group for USD 82.23M. The transaction was announced on 1/18/1998 and completed on 5/17/1999.
2003-05-27,PTEN US,TBDI US,Patterson-UTI Energy Inc acquired Tmbr/Sharp Drilling Inc for USD 82.17M. The transaction was announced on 5/27/2003 and completed on 2/12/2004.
1999-12-20,ONB US,0163712D US,Old National Bancorp/IN acquired Permanent Bancorp Inc for USD 82.10M. The transaction was announced on 12/20/1999 and completed on 7/28/2000.
2012-08-07,HD US,USHS US,Home Depot Inc/The acquired US Home Systems Inc for USD 81.89M. The transaction was announced on 8/7/2012 and completed on 10/29/2012.
1998-06-22,2567699D US,NETVA US,Enterasys Networks Inc acquired Netvantage Inc for USD 81.48M. The transaction was announced on 6/22/1998 and completed on 9/28/1998.
2014-12-22,1860560D US,UPI US,Cogentix Medical Inc acquired Uroplasty Inc for USD 81.43M. The transaction was announced on 12/22/2014 and completed on 4/1/2015.
2008-04-09,STJ US,EPMD US,St Jude Medical Inc acquired EP Medsystems Inc for USD 81.31M. The transaction was announced on 4/9/2008 and completed on 7/8/2008.
2001-08-01,CHTRQ US,1726653D US,Charter Communications Inc/Old acquired High Speed Access Corp for USD 81.10M. The transaction was announced on 8/1/2001 and completed on 2/28/2002.
1998-10-22,CGCP US,3513Q US,Cardiogenesis Corp acquired CardioGenesis Corp/Old for USD 81.05M. The transaction was announced on 10/22/1998 and completed on 3/18/1999.
2006-04-13,CBSH US,WTPT US,Commerce Bancshares Inc/MO acquired West Pointe Bancorp Inc for USD 80.90M. The transaction was announced on 4/13/2006 and completed on 9/5/2006.
2010-05-13,MMSI US,BSMD US,Merit Medical Systems Inc acquired BioSphere Medical Inc for USD 80.68M. The transaction was announced on 5/13/2010 and completed on 9/13/2010.
2021-10-04,CBU US,ESBK US,Community Financial System Inc acquired Elmira Savings Bank for USD 80.67M. The transaction was announced on 10/4/2021 and completed on 5/16/2022.
2007-12-27,2258717D US,DOCX US,EMC Corp acquired Document Sciences Corp for USD 80.63M. The transaction was announced on 12/27/2007 and completed on 3/7/2008.
2012-05-14,PSTB US,CSBC US,Park Sterling Corp acquired Citizens South Banking Corp for USD 80.54M. The transaction was announced on 5/14/2012 and completed on 10/1/2012.
2018-07-05,ZBRA US,XPLR US,Zebra Technologies Corp acquired Xplore Technologies Corp for USD 80.51M. The transaction was announced on 7/5/2018 and completed on 8/15/2018.
2003-08-12,HBEK US,624003Q US,Humboldt Bancorp acquired California Independent Bancorp for USD 80.49M. The transaction was announced on 8/12/2003 and completed on 1/7/2004.
2002-12-16,CLGX US,628774Q US,CoreLogic Inc acquired US Search.com for USD 80.37M. The transaction was announced on 12/16/2002 and completed on 6/6/2003.
1998-12-10,0852602D US,555873Q US,Promistar Financial Corp acquired First Philson Financial Corp for USD 80.09M. The transaction was announced on 12/10/1998 and completed on 7/15/1999.
1999-04-06,HAIN US,206435Q US,Hain Celestial Group Inc/The acquired Natural Nutrition Group Inc for USD 80.00M. The transaction was announced on 4/6/1999 and completed on 5/19/1999.
1998-02-11,2649Q US,2813531Q US,Devon Energy Corp/Old acquired Burlington RES Coal Seam Gas for USD 80.00M. The transaction was announced on 2/11/1998 and completed on 3/16/1998.
2011-04-27,MYGN US,1937324D US,Myriad Genetics Inc acquired Myriad RBM Inc for USD 80.00M. The transaction was announced on 4/27/2011 and completed on 6/1/2011.
2012-04-05,SPPI US,ALTH US,Spectrum Pharmaceuticals Inc acquired Allos Therapeutics Inc for USD 79.78M. The transaction was announced on 4/5/2012 and completed on 9/6/2012.
1998-03-23,IXX US,UPAC US,IPC Inc acquired Ultra PAC Inc for USD 79.76M. The transaction was announced on 3/23/1998 and completed on 4/24/1998.
2018-03-05,SOHO US,1580905D US,Sotherly Hotels Inc acquired Hyatt Centric - Hyatt Hotels Corp for USD 79.70M. The transaction was completed on 3/5/2018.
2004-05-06,FNB US,SRCK US,FNB Corp/PA acquired Slippery Rock Financial Corp for USD 79.69M. The transaction was announced on 5/6/2004 and completed on 10/14/2004.
2000-01-28,373937Q US,3369Q US,Leapnet Inc acquired SPR Inc for USD 79.57M. The transaction was announced on 1/28/2000 and completed on 5/2/2000.
2014-11-04,ENOC US,XWES US,Enel X North America Inc acquired World Energy Solutions Inc/MA for USD 79.55M. The transaction was announced on 11/4/2014 and completed on 1/6/2015.
2003-06-09,CBU US,GRGN US,Community Financial System Inc acquired Grange National Banc Corp for USD 79.53M. The transaction was announced on 6/9/2003 and completed on 11/24/2003.
2001-09-11,FINN US,667849Q US,First National of Nebraska Inc acquired Castle Bancgroup Inc for USD 79.51M. The transaction was announced on 9/11/2001 and completed on 2/1/2002.
2019-12-10,FDBC US,MNBC US,Fidelity D&D Bancorp Inc acquired MNB Corp for USD 79.37M. The transaction was announced on 12/10/2019 and completed on 4/30/2020.
2001-04-02,CHD US,USAD US,Church & Dwight Co Inc acquired USA Detergents Inc for USD 79.28M. The transaction was announced on 4/2/2001 and completed on 5/29/2001.
2007-05-15,BBT US,FAPB US,Beacon Financial Corp acquired Factory Point Bancorp Inc for USD 79.22M. The transaction was announced on 5/15/2007 and completed on 9/24/2007.
2001-12-07,MENT US,IKOS US,Mentor Graphics Corp acquired IKOS Systems Inc for USD 79.08M. The transaction was announced on 12/7/2001 and completed on 4/19/2002.
2008-07-17,ON US,8218892Q US,ON Semiconductor Corp acquired Catalyst Semiconductor Inc for USD 78.94M. The transaction was announced on 7/17/2008 and completed on 10/13/2008.
1998-09-25,FITB US,1521828D US,Fifth Third Bancorp acquired Enterprise Federal Bancorp for USD 78.92M. The transaction was announced on 9/25/1998 and completed on 5/17/1999.
2002-07-22,PNWB US,BKNW US,Pacific Northwest Bancorp acquired Bank of the Northwest/OR for USD 78.71M. The transaction was announced on 7/22/2002 and completed on 11/14/2002.
2014-06-24,STBZ US,GECR US,State Bank Financial Corp acquired Georgia-Carolina Bancshares Inc for USD 78.68M. The transaction was announced on 6/24/2014 and completed on 1/6/2015.
2022-12-13,LAMR US,LAMR US,Mediaco Holding Inc sold Lamar Advertising Co to Lamar Advertising Co for USD 78.60M. The transaction was completed on 12/13/2022.
1999-12-15,FBNC US,SOPN US,First Bancorp/Southern Pines NC acquired First Savings Bancorp Inc for USD 78.58M. The transaction was announced on 12/15/1999 and completed on 9/15/2000.
2012-01-25,ONB US,INCB US,Old National Bancorp/IN acquired Indiana Community Bancorp for USD 78.56M. The transaction was announced on 1/25/2012 and completed on 9/17/2012.
2000-03-27,FNFG US,8262097Q US,First Niagara Financial Group Inc acquired Iroquois Bancorp Inc/NY for USD 78.56M. The transaction was announced on 3/27/2000 and completed on 11/6/2000.
1999-07-29,OAKT US,XION US,Oak Technology LLC acquired Xionics Document Technologies Inc for USD 78.52M. The transaction was announced on 7/29/1999 and completed on 1/12/2000.
2018-10-15,PRMW CN,WATR US,Great Range Capital LLC sold Mountain Valley Spring Co to Primo Water Corp for USD 78.50M. The transaction was completed on 10/15/2018.
2008-04-29,GWR US,3384953Q US,Genesee & Wyoming Inc acquired CAGY Industries Inc for USD 78.40M. The transaction was announced on 4/29/2008 and completed on 8/12/2008.
2001-12-18,1779128D US,194510Q US,Respironics Inc acquired Novametrix Medical Systems Inc for USD 78.27M. The transaction was announced on 12/18/2001 and completed on 4/15/2002.
2017-12-11,FMBH US,FIRT US,First Mid Bancshares Inc acquired First BancTrust Corp for USD 78.25M. The transaction was announced on 12/11/2017 and completed on 5/2/2018.
2007-01-12,MOG/A US,ZVXI US,Moog Inc acquired Zevex International Inc for USD 78.22M. The transaction was announced on 1/12/2007 and completed on 3/19/2007.
2001-01-16,UPS US,FNCE US,United Parcel Service Inc acquired First International Bancorp Inc for USD 78.00M. The transaction was announced on 1/16/2001 and completed on 8/8/2001.
2018-10-22,VYX US,JTPY US,On 10/22/18 it was announced definitive agreement to acquire JetPay Corp for USD 5.05 per share. The transaction was completed on 12/07/2018.
2010-10-06,ONB US,MROE US,Old National Bancorp/IN acquired Monroe Bancorp for USD 77.82M. The transaction was announced on 10/6/2010 and completed on 1/3/2011.
2003-10-22,KTO US,3667737Q US,K2 Inc acquired Brass Eagle Inc for USD 77.80M. The transaction was announced on 10/22/2003 and completed on 12/16/2003.
2001-07-19,CMKC US,LFMN US,Cross Media Marketing Corp acquired LifeMinders Inc for USD 77.52M. The transaction was announced on 7/19/2001 and completed on 10/25/2001.
2002-12-05,1806854D US,HOOV US,Dun & Bradstreet Corp/The acquired Hoovers Inc for USD 77.50M. The transaction was announced on 12/5/2002 and completed on 3/4/2003.
2018-01-16,MPB US,FPBK US,Mid Penn Bancorp Inc acquired First Priority Financial Corp for USD 77.20M. The transaction was announced on 1/16/2018 and completed on 8/2/2018.
2010-09-08,ZRAN US,TUNE US,Zoran Corp acquired Microtune Inc for USD 77.12M. The transaction was announced on 9/8/2010 and completed on 12/1/2010.
2006-04-20,GBCI US,ZZGFU US,Glacier Bancorp Inc acquired Citizens Development Co for USD 77.00M. The transaction was announced on 4/20/2006 and completed on 10/2/2006.
1998-06-01,USX US,1735975D US,US Xpress Enterprises Inc acquired PST Vans Inc for USD 76.84M. The transaction was announced on 6/1/1998 and completed on 8/31/1998.
2013-06-14,FNB US,BCSB US,FNB Corp/PA acquired BCSB Bancorp Inc for USD 76.80M. The transaction was announced on 6/14/2013 and completed on 2/18/2014.
2002-09-25,SNV US,UFHI US,Synovus Financial Corp acquired United Financial Holdings Inc/FL for USD 76.77M. The transaction was announced on 9/25/2002 and completed on 3/3/2003.
2016-11-04,NIC US,FMBJ US,Nicolet Bankshares Inc acquired First Menasha Bancshares Inc for USD 76.60M. The transaction was announced on 11/4/2016 and completed on 5/4/2017.
2006-07-27,IBKC US,PFSL US,IBERIABANK Corp acquired Pocahontas Bancorp Inc for USD 76.58M. The transaction was announced on 7/27/2006 and completed on 2/2/2007.
2005-09-13,1255173D US,828568Q US,Wachovia Corp acquired AmNet Mortgage Inc for USD 76.56M. The transaction was announced on 9/13/2005 and completed on 12/13/2005.
2001-10-15,UNP US,580195Q US,Union Pacific Corp acquired Motor Cargo Industries Inc for USD 76.53M. The transaction was announced on 10/15/2001 and completed on 2/15/2002.
2001-05-23,MATW US,YRKG US,Matthews International Corp acquired York Group Inc/The for USD 76.40M. The transaction was announced on 5/23/2001 and completed on 12/4/2001.
2003-07-30,SCMF US,CKPM US,Southern Community Financial Corp/NC acquired Community Bank/Pilot Mountain for USD 76.31M. The transaction was announced on 7/30/2003 and completed on 1/12/2004.
2010-10-12,BBT US,ROME US,Beacon Financial Corp acquired Rome Bancorp Inc for USD 76.25M. The transaction was announced on 10/12/2010 and completed on 4/4/2011.
2014-02-13,GADS US,LCAV US,Gadsden Properties Inc acquired LCA-Vision Inc for USD 76.24M. The transaction was announced on 2/13/2014 and completed on 5/13/2014.
2001-02-22,WSBC US,352218Q US,WesBanco Inc acquired American Bancorporation for USD 76.23M. The transaction was announced on 2/22/2001 and completed on 3/1/2002.
1999-03-17,PLXS US,SEMD US,Plexus Corp acquired Seamed Corp for USD 76.22M. The transaction was announced on 3/17/1999 and completed on 7/26/1999.
2019-02-12,EW US,CASM US,Edwards Lifesciences Corp acquired CAS Medical Systems Inc for USD 76.12M. The transaction was announced on 2/12/2019 and completed on 4/22/2019.
2018-07-17,FSBW US,ANCB US,FS Bancorp Inc acquired Anchor Bancorp Inc/WA for USD 76.04M. The transaction was announced on 7/17/2018 and completed on 11/16/2018.
2003-11-10,FPFCQ US,0796405D US,First Place Financial Corp/OH acquired Franklin Bancorp Inc/MI for USD 76.02M. The transaction was announced on 11/10/2003 and completed on 6/1/2004.
2003-07-18,ESC US,ATHCQ US,Emeritus Corp acquired Brookdale Senior Living Communities Inc for USD 76.00M. The transaction was announced on 7/18/2003 and completed on 12/8/2003.
2000-02-14,SBAN US,150201Q US,SouthBanc Shares Inc acquired Heritage Bancorp Inc/SC for USD 75.91M. The transaction was announced on 2/14/2000 and completed on 8/1/2000.
2002-10-24,2674129Q US,METF US,Sky Financial Group Inc acquired Metropolitan Financial Corp for USD 75.88M. The transaction was announced on 10/24/2002 and completed on 5/1/2003.
1999-07-08,FMFC US,CFTP US,First M&F Corp acquired Community Federal Bancorp Inc for USD 75.88M. The transaction was announced on 7/8/1999 and completed on 11/22/1999.
2011-04-06,9980328D US,ORCH US,Laboratory Corp of America Holdings acquired Orchid Cellmark Inc for USD 75.87M. The transaction was announced on 04/06/2011 and completed on 12/20/2011.
2009-12-14,AMG US,HBRF US,Affiliated Managers Group Inc acquired Highbury Financial Inc for USD 75.84M. The transaction was announced on 12/14/2009 and completed on 4/16/2010.
2001-01-18,OEI US,TXLI US,Devon OEI Operating LLC acquired Texoil Inc for USD 75.78M. The transaction was announced on 1/18/2001 and completed on 3/22/2001.
2003-02-04,PERY US,2777116Q US,Perry Ellis International Inc acquired Salant Corp for USD 75.74M. The transaction was announced on 2/4/2003 and completed on 6/23/2003.
2002-08-29,WDR US,2832915Q CN,Waddell & Reed Financial Inc acquired Mackenzie Investment Management Inc for CAD 117.72M. The transaction was announced on 8/29/2002 and completed on 12/18/2002.
2006-03-21,,ERIF US,A consortium led by Erie Indemnity Co acquired Erie Family Life Insurance Co for USD 75.30M. The transaction was announced on 3/21/2006 and completed on 5/31/2006.
2000-07-06,153550Q US,598014Q US,F&M National Corp acquired Atlantic Financial Corp for USD 75.15M. The transaction was announced on 7/6/2000 and completed on 2/27/2001.
1998-01-04,679882Q US,2810Q US,F&M Bancorp/MD acquired Monocacy Bancshares Inc for USD 75.13M. The transaction was announced on 1/4/1998 and completed on 12/1/1998.
2000-01-14,IBM US,ASWE US,International Business Machine acquired Accessible Software Inc for USD 75.00M. The transaction was announced on 1/14/2000 and completed on 2/11/2000.
1999-05-27,SPH US,SPH US,Millennium Chemicals Inc sold Suburban Propane Partners LP to Suburban Propane Partners LP for USD 75.00M. The transaction was completed on 5/27/1999.
2009-06-11,IVZ US,GBX US,Invesco Ltd acquired Greenbrier Cos Inc/The for USD 75.00M. The transaction was completed on 6/11/2009.
2022-07-05,SYRS US,TYME US,Syros Pharmaceuticals Inc acquired Tyme Technologies Inc for USD 74.62M. The transaction was announced on 7/5/2022 and completed on 9/19/2022.
2002-11-13,JNJ US,OPHM US,Johnson & Johnson acquired OraPharma Inc for USD 74.42M. The transaction was announced on 11/13/2002 and completed on 2/11/2003.
2000-05-24,FPFCQ US,FFYF US,First Place Financial Corp/OH acquired FFY Financial Corp for USD 74.41M. The transaction was announced on 5/24/2000 and completed on 12/26/2000.
2003-10-27,CBRI US,SCBI US,CMTSU Liquidation Inc acquired SCB Computer Technology Inc for USD 74.40M. The transaction was announced on 10/27/2003 and completed on 3/8/2004.
2008-09-05,OAK US,NCEM US,Oaktree Capital Group LLC acquired Nevada Chemicals Inc for USD 74.32M. The transaction was announced on 9/5/2008 and completed on 10/23/2008.
2006-08-29,BOFLQ US,OFBS US,Bank of Florida Corp acquired Old Florida Bankshares Inc for USD 74.29M. The transaction was announced on 8/29/2006 and completed on 5/11/2007.
2004-12-29,CHCO US,1050311Q US,City Holding Co acquired Classic Bancshares Inc for USD 74.11M. The transaction was announced on 12/29/2004 and completed on 5/23/2005.
2017-10-06,FBMS US,MDNB US,First Bancshares Inc/The acquired Minden Bancorp Inc for USD 74.10M. The transaction was announced on 10/6/2017 and completed on 1/2/2018.
2015-02-19,HBNC US,PBNI US,Horizon Bancorp Inc/IN acquired Peoples Bancorp Inc/Auburn IN for USD 74.04M. The transaction was announced on 2/19/2015 and completed on 7/7/2015.
2001-10-01,953386Q US,PBKB US,Firstfed America Bancorp Inc acquired Peoples Bancshares Inc/MA for USD 73.99M. The transaction was announced on 10/1/2001 and completed on 3/1/2002.
2007-03-26,MNR US,MONM US,Monmouth Real Estate Investment Corp acquired Monmouth Capital Corp for USD 73.95M. The transaction was announced on 3/26/2007 and completed on 7/31/2007.
2017-06-14,HBNC US,WBKC US,Horizon Bancorp Inc/IN acquired Wolverine Bancorp Inc for USD 73.85M. The transaction was announced on 6/14/2017 and completed on 10/18/2017.
1998-02-04,PLA US,SPZE US,Playboy Enterprises Inc acquired Spice Entertainment Cos Inc for USD 73.78M. The transaction was announced on 2/4/1998 and completed on 3/16/1999.
2010-08-06,TDG US,SEMO US,TransDigm Group Inc acquired Semco Instruments Inc for USD 73.50M. The transaction was announced on 8/6/2010 and completed on 9/9/2010.
2012-06-10,MRCY US,NOIZ US,Mercury Systems Inc acquired Mercury Commercial Electronics Inc for USD 73.38M. The transaction was announced on 6/10/2012 and completed on 8/9/2012.
1999-11-19,1911768D US,CNKT US,Calico Commerce Inc acquired Connectinc.com Co for USD 73.24M. The transaction was announced on 11/19/1999 and completed on 2/3/2000.
2007-08-14,CAC US,UNBH US,Camden National Corp acquired Union Bankshares Co/ME for USD 73.22M. The transaction was announced on 8/14/2007 and completed on 1/3/2008.
1998-04-14,AFSC US,3080Q US,Anchor Financial Corp acquired Comsouth Bankshares Inc for USD 73.21M. The transaction was announced on 4/14/1998 and completed on 9/1/1998.
2015-04-30,KN US,ADNC US,Knowles Corp acquired Audience Inc for USD 73.06M. The transaction was announced on 4/30/2015 and completed on 7/2/2015.
2001-02-02,1920486D US,LSCI US,Oracle America Inc acquired LSC Inc for USD 73.00M. The transaction was announced on 2/2/2001 and completed on 5/3/2001.
1999-12-01,INSM US,45194Q US,Insmed Inc acquired Celtrix Pharmaceuticals Inc for USD 72.80M. The transaction was announced on 12/1/1999 and completed on 6/1/2000.
2014-02-10,FIBK US,MTWF US,First Interstate BancSystem Inc acquired Mountain West Financial Corp for USD 72.80M. The transaction was announced on 2/10/2014 and completed on 8/19/2014.
2004-01-28,838969Q US,0883322D US,Fidelity National Financial Inc/Old acquired Sanchez Computer Associates LLC for USD 72.73M. The transaction was announced on 1/28/2004 and completed on 4/15/2004.
2000-01-07,ZION US,COBA US,Zions Bancorp NA acquired County Bank/AZ for USD 72.68M. The transaction was announced on 1/7/2000 and completed on 7/28/2000.
2000-09-07,EXEL US,AGTO US,Exelixis Inc acquired Agritope Inc for USD 72.67M. The transaction was announced on 9/7/2000 and completed on 12/11/2000.
2006-11-06,USB US,UBMT US,US Bancorp acquired United Financial Corp for USD 72.66M. The transaction was announced on 11/6/2006 and completed on 2/6/2007.
2019-09-11,FCBC US,HLND US,First Community Bankshares Inc acquired Highlands Bankshares Inc/VA for USD 72.61M. The transaction was announced on 9/11/2019 and completed on 1/2/2020.
2003-11-12,GE US,HDR US,General Electric Co acquired HPSC Inc for USD 72.57M. The transaction was announced on 11/12/2003 and completed on 1/13/2004.
2005-01-07,JPM US,VAST US,JPMorgan Chase & Co acquired Livingston International Technology Services Corp for USD 72.56M. The transaction was announced on 1/7/2005 and completed on 4/4/2005.
2003-04-24,NEB US,SFGB US,Deluxe Business Operations Inc acquired Safeguard Business Systems Inc for USD 72.50M. The transaction was announced on 4/24/2003 and completed on 6/30/2003.
2009-08-03,PSEC US,PCAP US,Prospect Capital Corp acquired Patriot Capital Funding Inc for USD 72.49M. The transaction was announced on 8/3/2009 and completed on 12/3/2009.
1998-12-07,LBAI US,HPFC US,Lakeland Bancorp Inc acquired High Point Financial Corp for USD 72.38M. The transaction was announced on 12/7/1998 and completed on 7/16/1999.
1998-02-18,1068347D US,RAUT US,Keystone Automotive Industries Inc acquired Keystone Automotive Industries Resources Inc for USD 72.22M. The transaction was announced on 2/18/1998 and completed on 6/29/1998.
2003-02-24,FBNW US,OTFC US,FirstBank NW Corp acquired Oregon Trail Financial Corp for USD 72.16M. The transaction was announced on 2/24/2003 and completed on 11/3/2003.
2000-03-15,388103Q US,SJFC US,Richmond County Financial Corp acquired South Jersey Financial Corp Inc for USD 72.08M. The transaction was announced on 3/15/2000 and completed on 8/1/2000.
2001-07-09,3417644Q US,204718Q US,Education Management Corp/Old acquired Argosy Education Group Inc for USD 72.06M. The transaction was announced on 7/9/2001 and completed on 12/24/2001.
1999-07-11,1611364D US,TSQD US,Digital River Inc acquired Tech Squared Inc for USD 72.00M. The transaction was announced on 7/11/1999 and completed on 12/20/1999.
2006-10-05,FSNMQ US,FRGC US,First State Bancorporation/NM acquired Front Range Capital Corp for USD 72.00M. The transaction was announced on 10/5/2006 and completed on 1/31/2007.
1998-04-01,3075370Q US,3406Q US,Aspect Communications Corp acquired Voicetek Corp for USD 72.00M. The transaction was announced on 4/1/1998 and completed on 5/11/1998.
2010-05-25,KRNY US,CJBK US,Kearny Financial Corp/MD acquired Central Jersey Bancorp/Ocean Township NJ for USD 71.93M. The transaction was announced on 5/25/2010 and completed on 12/1/2010.
2003-04-09,8397627Q US,RYOU US,Psychiatric Solutions Inc acquired Ramsay Youth Services Inc for USD 71.81M. The transaction was announced on 4/9/2003 and completed on 7/1/2003.
2009-07-29,OSGIQ US,OSP US,Overseas Shipholding Group Inc/Old acquired OSG America LP for USD 71.79M. The transaction was announced on 7/29/2009 and completed on 12/18/2009.
2005-04-14,BSX US,RMDC US,Boston Scientific Corp acquired Rubicon Medical Corp for USD 71.70M. The transaction was announced on 4/14/2005 and completed on 6/16/2005.
1998-02-23,OCR US,770878Q US,Omnicare Inc acquired Compscript Inc for USD 71.70M. The transaction was announced on 2/23/1998 and completed on 6/29/1998.
1999-10-05,SUG US,589987Z US,Southern Union Co acquired Fall River Gas Co for USD 71.60M. The transaction was announced on 10/5/1999 and completed on 10/19/2000.
2000-07-26,2860436Q US,1848403D US,Liberty Interactive LLC acquired Video Services Corp for USD 71.59M. The transaction was announced on 7/26/2000 and completed on 12/26/2000.
2001-06-19,8215820Q US,220199Q US,Allied Capital Corp acquired Hillman Cos Inc/The for USD 71.52M. The transaction was announced on 6/19/2001 and completed on 9/27/2001.
