Announce Date,Acquirer Ticker,Target Ticker,Deal Description
2010-09-29,DHR US,KEI US,Danaher Corp acquired Keithley Instruments LLC for USD 300.41M. The transaction was announced on 9/29/2010 and completed on 12/9/2010.
2006-09-12,T US,USIXQ US,AT&T Inc acquired USinternetworking Inc for USD 300.00M. The transaction was announced on 9/12/2006 and completed on 10/31/2006.
2006-04-04,PMCS US,PSVE US,Microsemi Storage Solutions Inc acquired Passave Inc for USD 300.00M. The transaction was announced on 4/4/2006 and completed on 5/4/2006.
2010-05-11,ET US,1793839D US,General Electric Co sold Regency Energy Partners LP to Energy Transfer LP for USD 300.00M. The transaction was announced on 5/11/2010 and completed on 5/26/2010.
1998-12-03,ADP US,VCAM US,Automatic Data Processing Inc acquired ADP TotalSource Group Inc for USD 299.29M. The transaction was announced on 12/3/1998 and completed on 3/12/1999.
2007-12-12,TER US,8189407Q US,Teradyne Inc acquired Nextest Systems Corp for USD 298.98M. The transaction was announced on 12/12/2007 and completed on 1/25/2008.
2017-04-27,TOWN US,1766050D US,Towne Bank/Portsmouth VA acquired Paragon Commercial Corp for USD 298.65M. The transaction was announced on 4/27/2017 and completed on 1/29/2018.
2000-11-20,AGCO US,AGCH US,AGCO Corp acquired Ag-Chem Equipment Co Inc for USD 298.26M. The transaction was announced on 11/20/2000 and completed on 4/17/2001.
2003-12-09,540513Q US,CCBT US,Banknorth Group Inc acquired CCBT Financial Cos Inc for USD 297.79M. The transaction was announced on 12/9/2003 and completed on 5/3/2004.
2013-02-20,SSB US,FFCH US,SOUTHSTATE BANK CORP acquired First Financial Holdings Inc/Old for USD 296.30M. The transaction was announced on 2/20/2013 and completed on 7/29/2013.
2009-12-18,,IHR US,A consortium led by Shanghai Jinjiang International Hotels Co Ltd acquired Interstate Hotels & Resorts Inc for USD 295.82M. The transaction was announced on 12/18/2009 and completed on 3/18/2010.
2016-02-04,FORM US,CSCD US,FormFactor Inc acquired FormFactor Beaverton Inc for USD 295.80M. The transaction was announced on 2/4/2016 and completed on 6/27/2016.
2000-01-14,CVOVQ US,3107Q US,Cenveo Inc acquired American Business Products Inc for USD 295.76M. The transaction was announced on 1/14/2000 and completed on 2/23/2000.
2007-05-29,GENZ US,BIVN US,Genzyme Corp acquired Bioenvision LLC for USD 295.75M. The transaction was announced on 5/29/2007 and completed on 10/24/2007.
2003-11-20,VTR US,ETT US,Ventas Inc acquired ElderTrust for USD 295.35M. The transaction was announced on 11/20/2003 and completed on 2/6/2004.
2002-04-30,FNIS US,614806Q US,Fidelity National Information Solutions Inc acquired Micro General Corp for USD 294.81M. The transaction was announced on 4/30/2002 and completed on 7/10/2002.
2004-06-17,8258290Q US,2290040Q US,Old AII Inc acquired Commonwealth Industries Inc for USD 294.57M. The transaction was announced on 6/17/2004 and completed on 12/10/2004.
2005-10-20,2258717D US,CPTV US,EMC Corp acquired Captiva Software Corp for USD 294.54M. The transaction was announced on 10/20/2005 and completed on 1/3/2006.
2015-01-27,RRD US,CRRC US,RR Donnelley & Sons Co acquired Courier Corp for USD 293.86M. The transaction was announced on 1/27/2015 and completed on 6/9/2015.
1999-05-13,ICII US,91973Q US,Imperial Credit Industries Inc acquired Imperial Credit Commercial Mortgage Investment Corp for USD 293.47M. The transaction was announced on 5/13/1999 and completed on 3/29/2000.
1999-08-30,GDT US,69549Q US,Guidant LLC acquired CardioThoracic Systems Inc for USD 293.30M. The transaction was announced on 8/30/1999 and completed on 11/16/1999.
2010-06-10,SNPS US,VIRL US,Synopsys Inc acquired Virage Logic LLC for USD 293.25M. The transaction was announced on 6/10/2010 and completed on 9/3/2010.
2005-10-18,STLD US,RESC US,Steel Dynamics Inc acquired Roanoke Electric Steel Corp for USD 292.04M. The transaction was announced on 10/18/2005 and completed on 4/12/2006.
1998-03-02,1996074D US,843328Q US,El Paso LLC acquired Deeptech International Inc for USD 291.98M. The transaction was announced on 3/2/1998 and completed on 8/17/1998.
2010-06-16,COV US,1523381D US,Covidien Ltd acquired Somanetics Corp for USD 291.92M. The transaction was announced on 6/16/2010 and completed on 7/29/2010.
1999-02-18,3075558Q US,880783Q US,Summit Bancorp acquired Prime Bancorp Inc for USD 291.49M. The transaction was announced on 2/18/1999 and completed on 8/2/1999.
2005-06-28,1920486D US,SBYN US,Oracle America Inc acquired Seebeyond Technology Corp for USD 291.48M. The transaction was announced on 6/28/2005 and completed on 8/26/2005.
2018-10-08,,,Blackstone Inc sold 1 Ferry Building/San Francisco to a consortium led by Hudson Pacific Properties Inc for USD 291.00M. The transaction was announced on 10/8/2018 and completed on 10/9/2018.
2015-04-08,GNK US,BALT US,Genco Shipping & Trading Ltd acquired Baltic Trading Ltd for USD 290.72M. The transaction was announced on 4/8/2015 and completed on 7/20/2015.
2003-12-22,HAFC US,PUBB US,Hanmi Financial Corp acquired Pacific Union Bank for USD 290.25M. The transaction was announced on 12/22/2003 and completed on 5/3/2004.
2006-05-04,AMAT US,1292446D US,Applied Materials Inc acquired Applied Films Corp for USD 289.83M. The transaction was announced on 5/4/2006 and completed on 7/10/2006.
2000-09-27,PPC US,WLRF US,Pilgrim's Pride Corp acquired Pilgrims Pride Corp of Virginia Inc for USD 289.12M. The transaction was announced on 9/27/2000 and completed on 1/29/2001.
2021-03-29,PEBO US,PFBI US,Peoples Bancorp Inc/OH acquired Premier Financial Bancorp Inc for USD 288.94M. The transaction was announced on 3/29/2021 and completed on 9/20/2021.
1999-11-01,HON US,235958Q US,Honeywell International Inc acquired Tristar Aerospace Co for USD 288.76M. The transaction was announced on 11/1/1999 and completed on 12/7/1999.
1998-04-06,PRSU US,MNGM US,Pursuit Attractions and Hospit acquired MoneyGram Payment Systems Inc for USD 288.36M. The transaction was announced on 4/6/1998 and completed on 7/10/1998.
2002-07-24,FITB US,FNFN US,Fifth Third Bancorp acquired Franklin Financial Corp/TN for USD 287.66M. The transaction was announced on 7/24/2002 and completed on 6/14/2004.
1998-03-05,XRX US,694054Q US,Xerox Holdings Corp acquired Intelligent Electronics Inc for USD 287.66M. The transaction was announced on 3/5/1998 and completed on 5/21/1998.
2007-10-31,2596516D US,FCGI US,Computer Sciences Corp acquired First Consulting Group Inc for USD 286.65M. The transaction was announced on 10/31/2007 and completed on 1/14/2008.
1998-02-02,BMC US,BGSS US,BMC Software Inc acquired BGS Systems Inc for USD 285.30M. The transaction was announced on 2/2/1998 and completed on 3/27/1998.
2018-10-10,FRME US,MBTF US,First Merchants Corp acquired MBT Financial Corp for USD 284.74M. The transaction was announced on 10/10/2018 and completed on 9/4/2019.
2006-08-08,UPBD US,RWY US,Upbound Group Inc acquired Rent-Way Inc for USD 284.06M. The transaction was announced on 8/8/2006 and completed on 11/15/2006.
2003-11-03,PBKS US,SFFB US,Provident Bankshares Corp acquired Southern Financial Bancorp Inc for USD 283.45M. The transaction was announced on 11/3/2003 and completed on 5/3/2004.
2006-03-16,FSH US,1007985Q US,Behrman Capital LP/New York sold Athena Diagnostics Inc to Fisher Scientific International LLC for USD 283.00M. The transaction was announced on 3/16/2006 and completed on 6/30/2006.
2011-06-30,ANSS US,2571330D US,ANSYS Inc acquired Apache Design Inc for USD 282.83M. The transaction was announced on 6/30/2011 and completed on 8/1/2011.
2006-09-05,ITW US,CKCM US,Illinois Tool Works Inc acquired Click Commerce Inc for USD 282.11M. The transaction was announced on 9/5/2006 and completed on 10/27/2006.
1998-12-09,CDNS US,QKTN US,Cadence Design Systems Inc acquired Quickturn Design Systems Inc for USD 282.01M. The transaction was announced on 12/9/1998 and completed on 5/26/1999.
2012-02-06,1023761D US,CHUX US,Fidelity National Financial Inc/US acquired O'Charleys Inc for USD 281.95M. The transaction was announced on 2/6/2012 and completed on 5/10/2012.
2001-01-16,0941825D US,1304585D US,Macromedia Inc acquired Allaire Corp for USD 281.84M. The transaction was announced on 1/16/2001 and completed on 3/21/2001.
1999-03-11,GLK US,1416674D US,Imperial Credit Industries Inc sold Franchise Mortgage Acceptance Co to Great Lakes Bancorp Inc for USD 281.42M. The transaction was announced on 3/11/1999 and completed on 11/1/1999.
2005-01-18,MCDTA US,894800Q US,McDATA Corp acquired Computer Network Technology Corp for USD 281.36M. The transaction was announced on 1/18/2005 and completed on 6/1/2005.
2000-08-24,2313711D US,1508131D US,Mony Group Inc acquired Advest Group Inc/The for USD 281.20M. The transaction was announced on 8/24/2000 and completed on 2/1/2001.
2002-11-04,GE US,562424Q US,General Electric Co acquired GE Osmonics Inc for USD 281.06M. The transaction was announced on 11/4/2002 and completed on 2/28/2003.
2005-05-10,CRI US,GOSHA US,Carter's Inc acquired OshKosh B'Gosh Inc for USD 279.95M. The transaction was announced on 5/10/2005 and completed on 7/15/2005.
2010-04-10,HAL US,WEL US,Halliburton Co acquired Boots & Coots LLC for USD 279.70M. The transaction was announced on 4/10/2010 and completed on 9/18/2010.
2014-06-25,ACH US,MDCI US,Accendra Health Inc acquired Medical Action Industries Inc for USD 279.68M. The transaction was announced on 6/25/2014 and completed on 10/2/2014.
2021-06-23,COLB US,BOCH US,Columbia Banking System Inc acquired Bank of Commerce Holdings for USD 279.60M. The transaction was announced on 6/23/2021 and completed on 10/1/2021.
2014-04-11,AME US,ZIGO US,AMETEK Inc acquired Zygo Corp for USD 279.12M. The transaction was announced on 4/11/2014 and completed on 6/23/2014.
2013-12-23,9993232D US,1927291D US,Seagate Technology PLC acquired Xyratex Ltd for USD 278.65M. The transaction was announced on 12/23/2013 and completed on 3/31/2014.
1999-03-10,0687288D US,PWRH US,Anchor Gaming acquired Powerhouse Technologies Inc for USD 277.76M. The transaction was announced on 3/10/1999 and completed on 6/30/1999.
2006-10-17,BHE US,PMTR US,Benchmark Electronics Inc acquired Pemstar Inc for USD 277.74M. The transaction was announced on 10/17/2006 and completed on 1/9/2007.
2011-12-13,BAX US,,Baxter International Inc acquired Synovis Life Technologies Inc for USD 277.73M. The transaction was announced on 12/13/2011 and completed on 2/15/2012.
2008-09-02,TER US,0883461D US,Teradyne Inc acquired Eagle Test Systems Inc for USD 277.58M. The transaction was announced on 9/2/2008 and completed on 11/17/2008.
1998-12-01,1567696D US,DNFC US,Republic Bancorp Inc/MI acquired D&N Financial Corp for USD 277.41M. The transaction was announced on 12/1/1998 and completed on 5/18/1999.
2005-03-21,ASB US,SFSW US,Associated Banc-Corp acquired State Financial Services Corp for USD 277.28M. The transaction was announced on 3/21/2005 and completed on 10/4/2005.
2021-11-04,FRME US,LEVL US,First Merchants Corp acquired Level One Bancorp Inc for USD 277.19M. The transaction was announced on 11/4/2021 and completed on 4/1/2022.
1999-02-19,3346Q US,3562186Q US,US Bancorp/Old acquired Bank Commerce/San Diego for USD 276.62M. The transaction was announced on 2/19/1999 and completed on 7/16/1999.
2000-04-05,DLTR US,DLRX US,Dollar Tree Inc acquired Dollar Express Inc for USD 275.48M. The transaction was announced on 4/5/2000 and completed on 5/5/2000.
2021-03-31,GNLN US,KSHB US,Greenlane Holdings Inc acquired KushCo Holdings Inc for USD 275.36M. The transaction was announced on 3/31/2021 and completed on 8/31/2021.
2013-05-08,1537336D US,LEDR US,Trulia LLC acquired Market Leader Inc for USD 275.16M. The transaction was announced on 5/8/2013 and completed on 8/21/2013.
2006-05-16,PACW US,CMBC US,PacWest Bancorp acquired Community Bancorp Inc/CA for USD 274.01M. The transaction was announced on 5/16/2006 and completed on 10/27/2006.
2005-08-18,SCUR US,CGFW US,Secure Computing LLC acquired Cyberguard Corp for USD 273.99M. The transaction was announced on 8/18/2005 and completed on 1/12/2006.
2011-02-01,TWC US,0977766D US,Time Warner Cable Inc acquired NaviSite LLC for USD 273.68M. The transaction was announced on 2/1/2011 and completed on 4/25/2011.
2018-07-16,TDW US,GLF US,Tidewater Inc acquired Gulfmark Offshore Inc for USD 273.50M. The transaction was announced on 7/16/2018 and completed on 11/16/2018.
1998-12-27,FCHDQ US,KTIC US,Fairchild Corp/The acquired Kaynar Technologies Inc for USD 272.68M. The transaction was announced on 12/27/1998 and completed on 4/21/1999.
2012-01-17,BLKB US,CNVO US,Blackbaud Inc acquired Convio LLC for USD 272.33M. The transaction was announced on 1/17/2012 and completed on 5/8/2012.
1998-10-29,2217881D US,2966Q US,Eclipsys Corp acquired Transition Systems Inc for USD 272.08M. The transaction was announced on 10/29/1998 and completed on 1/4/1999.
2008-03-24,1847569D US,3047962Q US,L-1 Identity Solutions Inc acquired Digimarc Corp/Old for USD 271.75M. The transaction was announced on 3/24/2008 and completed on 8/15/2008.
1999-03-23,3017264Q US,506001Q US,ServiceMaster Co/The acquired American Residential Services LLC for USD 271.44M. The transaction was announced on 3/23/1999 and completed on 4/27/1999.
2021-06-03,UBSI US,ESXB US,United Bankshares Inc/WV acquired Community Bankers Trust Corp for USD 271.10M. The transaction was announced on 6/3/2021 and completed on 12/6/2021.
2005-06-09,2326248D US,NIKU US,CA Inc acquired Niku Corp for USD 270.83M. The transaction was announced on 6/9/2005 and completed on 8/1/2005.
2001-03-01,BGGSQ US,295228Q US,Briggs & Stratton Corp acquired Generac Portable Products Inc for USD 270.00M. The transaction was announced on 3/1/2001 and completed on 5/15/2001.
2008-07-16,CVG US,1526901D US,Convergys Corp acquired InterVoice LLC/TX for USD 269.56M. The transaction was announced on 7/16/2008 and completed on 9/4/2008.
2001-01-29,DIS US,289416Q US,Walt Disney Co/The acquired Walt Disney Internet Group for USD 269.55M. The transaction was announced on 1/29/2001 and completed on 3/20/2001.
2006-11-02,FLG US,2314466D US,Flagstar Bank FSB acquired PennFed Financial Services Inc for USD 269.06M. The transaction was announced on 11/2/2006 and completed on 4/2/2007.
2018-12-12,BHC CN,SGYPQ US,Bausch Health Cos Inc acquired Synergy Pharmaceuticals LLC for USD 268.93M. The transaction was announced on 12/12/2018 and completed on 5/2/2019.
2011-02-07,KTOS US,HRLY US,Kratos Defense & Security Solutions Inc acquired Herley Industries Inc for USD 268.61M. The transaction was announced on 2/7/2011 and completed on 4/1/2011.
2021-01-27,SYBT US,KTYB US,Stock Yards Bancorp Inc acquired Kentucky Bancshares Inc for USD 268.47M. The transaction was announced on 1/27/2021 and completed on 6/1/2021.
2020-03-12,PFS US,SBBX US,Provident Financial Services Inc acquired SB One Bancorp for USD 268.44M. The transaction was announced on 3/12/2020 and completed on 8/3/2020.
2000-08-11,ZLC US,PGDA US,Zale Corp acquired Piercing Pagoda Inc for USD 268.36M. The transaction was announced on 8/11/2000 and completed on 10/2/2000.
2002-09-30,APC US,HWL US,Anadarko Petroleum Corp acquired Howell Corp for USD 268.34M. The transaction was announced on 9/30/2002 and completed on 12/9/2002.
1999-12-01,KG US,MRE US,KP Pharmaceuticals LLC acquired King Pharmaceuticals Research and Development LLC for USD 268.19M. The transaction was announced on 12/1/1999 and completed on 2/28/2000.
2016-04-07,GLW US,AFOP US,Corning Inc acquired Alliance Fiber Optic Products Inc for USD 268.10M. The transaction was announced on 4/7/2016 and completed on 6/7/2016.
2004-08-09,TRA US,MSPIQ US,Terra Industries Inc acquired Terra Mississippi Holdings Corp for USD 268.00M. The transaction was announced on 8/9/2004 and completed on 12/21/2004.
2014-07-15,TOWN US,FRNK US,Towne Bank/Portsmouth VA acquired Franklin Financial Corp/VA for USD 267.77M. The transaction was announced on 7/15/2014 and completed on 1/5/2015.
2015-02-27,CLM US,CFP US,Cornerstone Strategic Investme acquired Cornerstone Progressive Return Fund for USD 266.64M. The transaction was announced on 2/27/2015 and completed on 6/29/2015.
2001-08-13,CAR US,2677838Q US,Avis Budget Group Inc acquired Cheap Tickets Inc for USD 265.82M. The transaction was announced on 8/13/2001 and completed on 10/9/2001.
1998-02-23,MFE US,TISX US,McAfee Inc acquired Trusted Information Systems Inc/ DE for USD 265.54M. The transaction was announced on 2/23/1998 and completed on 4/28/1998.
2015-09-03,DIOD US,PSEM US,Diodes Inc acquired Pericom Semiconductor Corp for USD 265.50M. The transaction was announced on 9/3/2015 and completed on 11/25/2015.
1998-07-31,3024Q US,0900232D US,Banknorth Group Inc/Brattleboro VT acquired Evergreen Bancorp Inc for USD 265.40M. The transaction was announced on 7/31/1998 and completed on 1/4/1999.
1998-01-12,390297Q US,180638Q US,Mercantile Bancorporation Inc acquired CBT Corp/KY for USD 264.33M. The transaction was announced on 1/12/1998 and completed on 7/1/1998.
2000-10-31,ANAT US,158351Q US,American National Group Inc acquired Farm Family Holdings Inc for USD 264.18M. The transaction was announced on 10/31/2000 and completed on 4/11/2001.
2004-09-23,STJ US,740860Q US,St Jude Medical Inc acquired Endocardial Solutions Inc for USD 264.16M. The transaction was announced on 9/23/2004 and completed on 1/14/2005.
1999-07-30,WFC US,PBTX US,Wells Fargo & Co acquired Prime Bancshares Inc/TX for USD 264.11M. The transaction was announced on 7/30/1999 and completed on 1/31/2000.
2004-06-14,HTRN US,PMSI US,HealthTronics Inc acquired Prime Medical Services Inc for USD 263.78M. The transaction was announced on 6/14/2004 and completed on 11/11/2004.
2006-02-09,HCBK US,SFFS US,Hudson City Bancorp Inc acquired Sound Federal Bancorp Inc for USD 263.65M. The transaction was announced on 2/9/2006 and completed on 7/17/2006.
2003-05-21,MAFB US,1838147D US,MAF Bancorp Inc acquired St Francis Capital Corp for USD 263.52M. The transaction was announced on 5/21/2003 and completed on 12/2/2003.
2004-02-25,JNY US,MAXS US,Jones Group Inc/NY acquired Maxwell Shoe Co for USD 263.51M. The transaction was announced on 2/25/2004 and completed on 7/9/2004.
2009-10-09,KMB US,IFLO US,Kimberly-Clark Corp acquired I-Flow Corp for USD 263.34M. The transaction was announced on 10/9/2009 and completed on 11/25/2009.
2011-01-26,SUSQ US,ABBC US,Susquehanna Bancshares Inc acquired Abington Bancorp Inc for USD 262.77M. The transaction was announced on 1/26/2011 and completed on 10/3/2011.
2007-10-23,,3412150Q US,A consortium led by Intoll Group acquired Waste Industries USA LLC for USD 262.72M. The transaction was announced on 10/23/2007 and completed on 5/12/2008.
2006-04-24,JDAS US,0564535D US,Blue Yonder Group Inc acquired Manugistics Group Inc for USD 262.58M. The transaction was announced on 4/24/2006 and completed on 7/6/2006.
2013-12-16,BHC CN,SLTM US,Bausch Health Cos Inc acquired Solta Medical Inc for USD 262.57M. The transaction was announced on 12/16/2013 and completed on 1/24/2014.
1998-09-18,MEDQ US,MRCG US,MModal MQ Inc acquired MRC Group Inc for USD 262.25M. The transaction was announced on 9/18/1998 and completed on 12/10/1998.
2014-01-06,XPO US,PACR US,XPO Inc acquired XPO Intermodal Inc for USD 262.09M. The transaction was announced on 1/6/2014 and completed on 4/2/2014.
2021-02-16,PGR US,PTVCB US,"On 02/06/2019, Insurance Insider reported that American Financial Group, Fairfax Financial, W.R. Berkley and RLI are said to be showing interest in bidding for Protective Insurance Corp according to people familiar with the matter."
2011-03-28,ATNY US,0949144D US,API Technologies Corp acquired Spectrum Control Inc for USD 261.65M. The transaction was announced on 3/28/2011 and completed on 6/2/2011.
2010-12-09,HOPE US,CLFC US,Hope Bancorp Inc acquired Center Financial Corp/CA for USD 260.78M. The transaction was announced on 12/9/2010 and completed on 12/1/2011.
2007-11-13,SRGAQ US,TTG US,Surgalign Holdings Inc acquired Tutogen Medical Inc for USD 260.68M. The transaction was announced on 11/13/2007 and completed on 2/28/2008.
2007-08-07,ECL US,MTMD US,Ecolab Inc acquired Microtek Medical Holdings Inc for USD 260.57M. The transaction was announced on 8/7/2007 and completed on 11/12/2007.
2011-05-16,KTOS US,ISYS US,Kratos Defense & Security Solutions Inc acquired Integral Systems Inc/MD for USD 260.33M. The transaction was announced on 5/16/2011 and completed on 7/28/2011.
2010-05-06,ENDPQ US,HTRN US,Endo International PLC acquired HealthTronics Inc for USD 260.31M. The transaction was announced on 5/6/2010 and completed on 7/15/2010.
2022-04-14,DHI US,VWTR US,DR Horton Inc acquired Vidler Water Resouces Inc for USD 260.28M. The transaction was announced on 4/14/2022 and completed on 5/26/2022.
2000-01-21,MO US,1723828D US,Altria Group Inc acquired Balance Bar Co for USD 260.25M. The transaction was announced on 1/21/2000 and completed on 3/3/2000.
2021-06-03,FFWM US,TGRF US,First Foundation Inc acquired TGR Financial Inc for USD 260.18M. The transaction was announced on 6/3/2021 and completed on 12/20/2021.
2013-08-30,CMLS US,1545746D US,Cumulus Media Inc acquired Westwood One LLC for USD 260.00M. The transaction was announced on 8/30/2013 and completed on 12/16/2013.
2021-04-05,GHC US,LEAF US,Graham Holdings Co acquired Leaf Group Ltd for USD 259.74M. The transaction was announced on 4/5/2021 and completed on 6/14/2021.
1998-05-29,496112Q US,2914Q US,First American Corp/TN acquired Pioneer Bancshares Inc/TN for USD 259.56M. The transaction was announced on 5/29/1998 and completed on 11/20/1998.
2004-03-08,0964591D US,3195391Z US,Biomet Inc acquired InterPore International for USD 259.45M. The transaction was announced on 3/8/2004 and completed on 6/21/2004.
1999-11-08,1642488D US,1506328D US,First Charter Corp acquired Carolina First Bancshares for USD 259.40M. The transaction was announced on 11/8/1999 and completed on 4/5/2000.
1999-11-01,2860436Q US,3574Q US,Liberty Interactive LLC acquired Four Media Co LLC for USD 259.06M. The transaction was announced on 11/1/1999 and completed on 4/10/2000.
2000-06-30,EXE US,GOTH US,Expand Energy Corp acquired Gothic Energy Corp for USD 258.90M. The transaction was announced on 6/30/2000 and completed on 1/19/2001.
2013-10-23,HFWA US,WBCO US,Heritage Financial Corp/WA acquired Washington Banking Co for USD 258.62M. The transaction was announced on 10/23/2013 and completed on 5/1/2014.
1998-04-09,RFH US,DART US,Richfood Holdings Inc acquired Dart Group Corp for USD 258.03M. The transaction was announced on 4/9/1998 and completed on 5/18/1998.
1999-01-28,TFC US,MSDX US,Truist Financial Corp acquired Mason-Dixon Bancshares Inc for USD 257.43M. The transaction was announced on 1/28/1999 and completed on 7/16/1999.
1998-06-24,2993Q US,1246Q US,MTL Inc/Old acquired Chemical Leaman Corp/FL for USD 257.00M. The transaction was announced on 6/24/1998 and completed on 8/28/1998.
2002-12-23,ATBA AV,1918732D US,Altaba Inc acquired Inktomi Corp for USD 256.86M. The transaction was announced on 12/23/2002 and completed on 3/20/2003.
2013-09-18,EWBC US,1489775D US,East West Bancorp Inc acquired MetroCorp Bancshares Inc for USD 256.43M. The transaction was announced on 9/18/2013 and completed on 1/21/2014.
2009-06-25,ASNAQ US,TWB US,Mahwah Bergen Retail Group Inc acquired Tween Brands Inc for USD 256.36M. The transaction was announced on 6/25/2009 and completed on 11/27/2009.
2019-02-05,SXC US,SXCP US,"The transaction was completed 06/28/2019. On 02/05/2019, SunCoke Energy Inc announced the acquisition of SunCoke Energy Partners LP for USD 256.12M."
2000-11-30,AIV US,OTF US,Apartment Investment and Management Co acquired Oxford Exempt Fund II LP for USD 256.00M. The transaction was announced on 11/30/2000 and completed on 3/27/2001.
1998-02-19,FSCO US,CSTB US,First Security Corp acquired First Security Bank of California NA for USD 255.93M. The transaction was announced on 2/19/1998 and completed on 6/1/1998.
1998-07-01,2319518D US,XPT US,Guidehouse Inc acquired LECG Inc for USD 255.91M. The transaction was announced on 7/1/1998 and completed on 8/20/1998.
1998-10-22,RVTY US,LNM US,Revvity Inc acquired Excelitas Technologies Sensors Inc for USD 255.85M. The transaction was announced on 10/22/1998 and completed on 1/5/1999.
2014-01-27,YDKN US,VSB US,Yadkin Financial Corp acquired VantageSouth Bancshares Inc for USD 255.25M. The transaction was announced on 1/27/2014 and completed on 7/7/2014.
2003-06-30,DFODQ US,2306218D US,Dean Foods Co acquired Horizon Organic Holding Corp for USD 255.08M. The transaction was announced on 6/30/2003 and completed on 1/5/2004.
2018-08-30,MCO US,REIS US,Moody's Corp acquired Reis Inc for USD 254.50M. The transaction was announced on 8/30/2018 and completed on 10/16/2018.
2002-04-24,CDNS US,583429Q US,Cadence Design Systems Inc acquired Simplex Solutions Inc/United States for USD 253.41M. The transaction was announced on 4/24/2002 and completed on 6/28/2002.
1998-10-08,1742858D US,1052387D US,Informa Media Inc acquired Internet World Media Inc for USD 252.88M. The transaction was announced on 10/8/1998 and completed on 11/25/1998.
2007-07-26,STEL US,3470770Q US,StellarOne Corp acquired FNB Corp/VA for USD 252.50M. The transaction was announced on 7/26/2007 and completed on 2/28/2008.
1998-02-25,TFC US,MFSL US,Truist Financial Corp acquired Maryland Federal Bancorp Inc for USD 251.87M. The transaction was announced on 2/25/1998 and completed on 10/1/1998.
1998-09-29,NEM US,NGC US,Newmont Corp acquired Newmont Gold Co for USD 251.81M. The transaction was announced on 9/29/1998 and completed on 10/8/1998.
